,ChemicalName,ChemicalDescription,Wiki Link,PrimaryCategory,ProductName0,"1,4-Dioxane",,,"Bath Products,Bath Products,Hair Care Products (non-coloring),Hair Care Products (non-coloring),Hair Care Products (non-coloring),Hair Care Products (non-coloring),Bath Products,Hair Care Products (non-coloring),Hair Care Products (non-coloring),Hair Care Products (non-coloring),Hair Care Products (non-coloring),Skin Care Products ,Skin Care Products ,Bath Products,Bath Products,Skin Care Products ,Skin Care Products ,Skin Care Products ,Skin Care Products ,Hair Care Products (non-coloring),Hair Care Products (non-coloring),Hair Care Products (non-coloring),Hair Care Products (non-coloring),Hair Care Products (non-coloring),Hair Care Products (non-coloring),Hair Care Products (non-coloring),Hair Care Products (non-coloring),Hair Care Products (non-coloring),Hair Care Products (non-coloring),Hair Care Products (non-coloring),Hair Care Products (non-coloring),Hair Care Products (non-coloring),Hair Care Products (non-coloring),Hair Care Products (non-coloring),Hair Care Products (non-coloring),Hair Care Products (non-coloring),Hair Care Products (non-coloring),Bath Products,Bath Products,Hair Care Products (non-coloring),Hair Care Products (non-coloring),Hair Care Products (non-coloring),Bath Products,Hair Care Products (non-coloring),Bath Products,Hair Care Products (non-coloring),Bath Products,Bath Products,Bath Products,Hair Care Products (non-coloring),Bath Products,Hair Care Products (non-coloring),Hair Care Products (non-coloring),Hair Care Products (non-coloring),Hair Care Products (non-coloring),Hair Care Products (non-coloring),Hair Care Products (non-coloring),Hair Care Products (non-coloring),Bath Products","ALOE VERA BODYWASH,ALOE VERA CONC. BODY WASH,ALOE VERA CONC. SHAMPOO,ALOE VERA SHAMPOO,AWAPUHI CONC. SHAMPOO,BODY ECLIPSE SHAMPOO,CITRUS NECTAR BODY WASH,Curl Lock Conditioner,Curl Lock Shampoo,EGF Cellular Activator,EUCALYPTUS BODY WASH,FRESH PEAR HAND AND BODY SOAP,Facial Cleanser,HEMPZ TREATS GINGERBREAD COOKIE DELICIOUS BODY LOTION,HONEY ALMOND SHAMPOO,Harmon  Face Values Brazilian Keratin Shampoo 21oz (w/pump),Harmon Face Values Argan Oil Conditioner 21oz  (w/pump),Harmon Face Values Argan Oil Shampoo 21oz (w/pump),Harmon Face Values Brazilian  Keratin 14 Days Straightening Treatment 4oz (boxed),Harmon Face Values Brazilian Keratin Conditioner 21oz (w/pump),Harmon Face Values Coconut Milk Nourishing Conditioner 21oz (w/pump),Harmon Face Values Coconut Milk Nourishing Shampoo 21oz (w/pump),Harmon Face Values Swim Repair Chlorine Removal Shampoo with Argan Oil 12oz,Harmon Face Values Swim Repair Conditioner with Argan Oil 12oz,Hydrate Conditioner,Hydrate Shampoo,Intensity Conditioning Therapy,Intensity Conditioning Treatment,Interrupt Texturizing Clay,JABONCILLO CONC. BODY WASH,Jaboncillo Body Wash,Moisturizing Conditioner,Moisturizing Shampoo,OCAEN BREEZE SHAMPOO,OCEAN BREEZE BODY WASH,OCEAN BREEZE CONC. SHAMPOO,PALA SPA BODY WASH,PALA SPA SHAMPOO,PAPAYA NECTAR BODY WASH,PAPAYA NECTAR CONC. BODY WASH,SPA REFRESH BATH GEL,SPA REFRESH SHAMPOO,SPORT FRESH BODY WASH,SPORT FRESH SHAMPOO,Texture Cream,Texture Cream Casual Styler,Texturizing Clay,Thickening Shampoo + Conditioner,VANILLA GINGER,VANILLA GINGER BODY WASH"1,"2,2-Bis(bromomethyl)-1,3-propanediol",,,"Skin Care Products ,Skin Care Products ,Skin Care Products ,Skin Care Products ",MOCARA serum ingredients2,"2,4-Hexadienal (89% trans, trans isomer; 11% cis, trans isomer)",,,"Skin Care Products ,Skin Care Products ,Sun-Related Products,Fragrances,Fragrances,Fragrances,Fragrances,Fragrances,Fragrances","Best of Skintentions,Halston Natural Spray Cologne,Halston Perfume,Halston Z-14 Natural Spray Cologne,Red Giorgio Beverly Hills Extraordinary Eau de Toilette Spray,Red Giorgio Beverly Hills Extraordinary Parfum"3,2-Propyleneacrolein,,,Makeup Products (non-permanent),Makeup Balancer No.14,Acetaldehyde,,,"Makeup Products (non-permanent),Skin Care Products ,Bath Products,Fragrances,Fragrances,Bath Products,Hair Care Products (non-coloring),Hair Care Products (non-coloring),Hair Care Products (non-coloring),Makeup Products (non-permanent),Skin Care Products ,Hair Care Products (non-coloring),Hair Care Products (non-coloring),Hair Care Products (non-coloring),Hair Care Products (non-coloring),Hair Care Products (non-coloring),Fragrances,Skin Care Products ,Makeup Products (non-permanent),Makeup Products (non-permanent),Makeup Products (non-permanent),Makeup Products (non-permanent),Makeup Products (non-permanent),Makeup Products (non-permanent),Makeup Products (non-permanent),Makeup Products (non-permanent),Makeup Products (non-permanent),Makeup Products (non-permanent),Makeup Products (non-permanent),Makeup Products (non-permanent),Makeup Products (non-permanent),Makeup Products (non-permanent),Makeup Products (non-permanent),Makeup Products (non-permanent),Makeup Products (non-permanent),Makeup Products (non-permanent),Makeup Products (non-permanent),Makeup Products (non-permanent),Makeup Products (non-permanent),Makeup Products (non-permanent),Makeup Products (non-permanent),Makeup Products (non-permanent),Makeup Products (non-permanent),Makeup Products (non-permanent),Fragrances,Fragrances,Skin Care Products ,Skin Care Products ,Bath Products,Fragrances,Hair Care Products (non-coloring),Hair Care Products (non-coloring),Hair Care Products (non-coloring),Hair Care Products (non-coloring)","Anti-Aging Eye and Lip Perfection a Porter,Badgley Mischka Glamorous Bath and Shower Gel,Badgley Mischka Glamorous Body Lotion,Badgley Mishka Glamorous Body Cream,Body Butter Apricot Scrub Bodywash,Curl Lock Conditioner,Curl Lock Shampoo,Delicious Lip Gloss Plump lip gloss immediate extra volume,Elizabeth Arden Peel and Reveal Revitalizing Treatment,Hydrate Conditioner,Intensity Conditioning Therapy,Interrupt Texturizing Clay,Jewel Alfred Sung Luxorious Body Lotion,Jewel Alfred Sung Luxorious Hand Cream,L'BEL COULEUR LUXE RESPLENDISANT XP FPS 15/ Ultra-Sensuous Volume Liquid Lip Color,Resplendisant XP ultra sensuous volume liquid lip color,Rouge Volumesse maximum volume effect lipstick SPF 21,Shi Alfred Sung Dusting Powder,Shi Alfred Sung Eau de Parfum,Shi Alfred Sung Moisture Balance Body Lotion,Shi Alfred Sung Moisture Balance Hand Cream,Shi Alfred Sung Moisture Balance Shower Gel,Shi Alfred Sung Parfum,Texture Cream,Texture Cream Casual Styler,Texturizing Clay,The Cream"5,"Acetic acid, retinyl ester",,,"Skin Care Products ,Skin Care Products ,Skin Care Products ","Rejuvenating Complex,Renewal Cream,Tri-Retinol Complex ES"6,Acetylsalicylic acid,,,Shaving Products,In-Grown Hair and Razor Bump Creme7,Acrylamide,,,"Skin Care Products ,Hair Care Products (non-coloring),Nail Products,Skin Care Products ","Horse Chestnut Varicose Spider Veins Cream,Moisturizing Shampoo,Quicken,i-LIFT CONTOUR CONCENTRATE"8,All-trans retinoic acid,,,"Bath Products,Skin Care Products ,Bath Products,Hair Care Products (non-coloring),Hair Care Products (non-coloring),Hair Care Products (non-coloring),Sun-Related Products,Hair Care Products (non-coloring)","GRAPEFRUIT BODY WASH,POMEGRANATE BODY LOTION,POMEGRANATE BODY WASH,Sea Blast Shampoo,Serum,Sultry,Titanium Self Tanner,Web"9,"Aloe vera, non-decolorized whole leaf extract",,,"Skin Care Products ,Skin Care Products ,Skin Care Products ,Makeup Products (non-permanent)","Essential Facial Moisturizer,Intensive Renewal Serum,Nourishing Eye Cream,Renewed Hope in a Jar Complete Concealer"10,"Aloe vera, whole leaf extract",,,"Shaving Products,Shaving Products,Nail Products,Sun-Related Products,Hair Coloring Products,Sun-Related Products,Sun-Related Products,Hair Coloring Products,Skin Care Products ,Skin Care Products ,Makeup Products (non-permanent),Makeup Products (non-permanent),Makeup Products (non-permanent),Makeup Products (non-permanent),Makeup Products (non-permanent),Makeup Products (non-permanent),Makeup Products (non-permanent),Makeup Products (non-permanent),Makeup Products (non-permanent),Makeup Products (non-permanent),Makeup Products (non-permanent),Makeup Products (non-permanent),Makeup Products (non-permanent),Makeup Products (non-permanent),Makeup Products (non-permanent),Makeup Products (non-permanent),Makeup Products (non-permanent),Makeup Products (non-permanent),Makeup Products (non-permanent),Makeup Products (non-permanent),Makeup Products (non-permanent),Makeup Products (non-permanent),Makeup Products (non-permanent),Makeup Products (non-permanent),Makeup Products (non-permanent),Makeup Products (non-permanent),Makeup Products (non-permanent),Makeup Products (non-permanent),Nail Products,Skin Care Products ,Sun-Related Products,Sun-Related Products,Sun-Related Products,Sun-Related Products,Sun-Related Products,Sun-Related Products,Sun-Related Products,Sun-Related Products,Sun-Related Products,Sun-Related Products,Sun-Related Products,Sun-Related Products,Nail Products,Shaving Products,Skin Care Products ,Makeup Products (non-permanent),Makeup Products (non-permanent),Skin Care Products ,Skin Care Products ,Skin Care Products ,Skin Care Products ,Skin Care Products ,Skin Care Products ,Skin Care Products ,Shaving Products,Sun-Related Products,Skin Care Products ,Makeup Products (non-permanent),Makeup Products (non-permanent),Skin Care Products ,Skin Care Products ,Skin Care Products ,Skin Care Products ,Skin Care Products ,Sun-Related Products,Shaving Products,Skin Care Products ,Nail Products,Nail Products,Shaving Products,Nail Products,Hair Care Products (non-coloring),Hair Care Products (non-coloring),Nail Products,Skin Care Products ,Nail Products,Sun-Related Products,Sun-Related Products,Sun-Related Products,Skin Care Products ,Skin Care Products ,Sun-Related Products,Skin Care Products ,Sun-Related Products,Skin Care Products ,Skin Care Products ,Skin Care Products ,Personal Care Products,Shaving Products,Sun-Related Products,Sun-Related Products,Sun-Related Products,Sun-Related Products,Sun-Related Products,Sun-Related Products,Sun-Related Products,Sun-Related Products,Sun-Related Products,Sun-Related Products,Sun-Related Products,Shaving Products,Sun-Related Products,Shaving Products,Skin Care Products ,Skin Care Products ,Sun-Related Products,Sun-Related Products,Makeup Products (non-permanent),Sun-Related Products,Sun-Related Products,Sun-Related Products,Sun-Related Products,Sun-Related Products,Sun-Related Products,Sun-Related Products,Sun-Related Products,Sun-Related Products,Sun-Related Products,Sun-Related Products,Sun-Related Products,Sun-Related Products,Nail Products,Makeup Products (non-permanent),Sun-Related Products,Skin Care Products ,Skin Care Products ,Skin Care Products ,Skin Care Products ","2-in-1 cream and conditioner Coconut Silk,2-in-1 cream and conditioner Sensitive Skin, Delicate Water Lily for senstive skin,Acetone-Free Polish Remover,After Sun Coolada Moisturizer,Age Defy CC+ Colorseal,Antioxidant + Sunscreen Lotion SPF 30 Broad Spectrum,Antioxidant + Sunscreen Lotion SPF 50 Broad Spectrum,Balayage for Brunettes,Breakout Control,Collagen Rehab (Mask),Colorlicious Fall 18 New Base Formula,Colorlicious Lipstick,Cuticle Rehab,DEEP WATER THERAPY FACIAL CREAM,Dark Tanning Oil,Dark Tanning Oil Spray SPF 6,Deep Tanning Dry Oil Clear Sunscreen Spray SPF 4,Deep Tanning Dry Oil Clear Sunscreen Spray SPF 8,Deep Tanning Spray Oil,Deep Tanning Spray Oil Sunscreen Spray SPF 4,Dry Balance Clear Sunscreen Spray SPF 30,Dry Balance Clear Sunscreen Spray SPF 50+,Dry Balance Sunscreen Lotion SPF 30,Dry Balance Sunscreen Lotion SPF 50+,Dry Oil Clear Spray Sunscreen Broad Spectrum SPF 12,Dry Oil Clear Spray Sunscreen Broad Spectrum SPF 30,Expert Touch Lacquer Remover,Extra Protection Shave Gel,FACE MASK,Foundation Stick,Gel Eyeliners,Glycolic Detox Charcoal Peel-Level 2,Glycolic Detox Charcoal Peel-Level 3,Hair Removal and Bleach,Hydro Sense Comfort Shave Cream,Island Tanning Dry Spray Oil  Broad Spectrum SPF 25,Juicy Kitten,Just Gimme Noir Gel Pot Eyeliner,Liquid Shadow,MENS NULL Face Wash,MENS NULL Hair Remover Cream,Matcha Mood,Measured Micrograins +,Moisturizing Aloe After Sun Lotion,Moisturizing Shave Cream Skin Therapy Sensitive Skin,Multi-Task Eye Creme,Nail Envy Natural Nail Strengthener Sensitive & Peeling,Nail Polish and Enamel Removers,Null After Shave Lotion,Original Polish Remover,PetLab ExtractosTM - Conditioner for Dogs - ALOE VERA and AVOCADO OIL - 1 GAL (3.79 L),PetLab ExtractosTM - Conditioner for Dogs - ALOE VERA and AVOCADO OIL - 10 FL OZ (296 ml),Pro Spa Skin Care Hands & Feet - Advanced Callus Softening Gel,Pro-Gel Acetone NPR,Protective Dry Oil Clear Sunscreen Spray UVA/UVB Broad Spectrum SPF 15,Protective Dry Oil Clear Sunscreen Spray UVA/UVB Broad Spectrum SPF 25,Protective Spray Oil Sunscreen Spray UVA/UVB Broad Spectrum SPF 15,Quick Refiner,Quick Refiner for Eyes,Ray Defence,Renewing Night Conditioner,Royal Tanning Clear Spray Triple Rich Blend,SEPHORA - LE MASQUE BULLES / THE BUBBLE MASK,SEPHORA - MASQUE MAINS ALOE VERA / ALOE VERA HAND MASKS,Sensitive Eye Smoother,Sensitive Skin Hand Wipes,Sensitve Skin Shave Gel,Sheer Touch After Sun Moisturizer Ultra Radiance,Sheer Touch Lotion Sunscreen Broad Spectrum SPF 8,Sheer Touch Lotion Sunscreen Ultra Radiance Broad Spectrum SPF 15,Sheer Touch Lotion Sunscreen Ultra Radiance Broad Spectrum SPF 30,Sheer Touch Lotion Sunscreen Ultra Radiance Broad Spectrum SPF 50,Silk Hydration Clear Spray Sunscreen Weightless Broad Spectrum SPF 30,Silk Hydration Clear Spray Sunscreen Weightless Broad Spectrum SPF 50,Silk Hydration Clear Spray Weightless Sunscreen Broad Spectrum SPF 15,Silk Hydration Lotion Sunscreen Weightless Broad Spectrum SPF 30,Silk Hydration Lotion Sunscreen Weightless Broad Spectrum SPF 50,Silk Hydration Oil Free Lotion Sunscreen Weightess Face Broad Spectrum SPF 30,Skin Therapy Moisturizing - Sensitive  Skin Shave Gel,Soothing Aloe After Sun Gel,Soothing Aloe Shave Gel,Soothing Eye Pad Solution,Soothing Reset Mist,Sport Performance Cool Zone Clear Sunscreen Spray  SPF 30,Sport Performance Coolzone  Clear Sunscreen Spray SPF 50+,Stick Illuminator,Summer Color Self Tanning Lotion  Airbrush Color,Summer Color Self Tanning Lotion Deep Dark Color,Summer Color Self Tanning Lotion Light Medium Color,Sun Comfort Clear Sunscreen Spray UVA/UVB Broad Spectrum SPF 30,Sun Comfort Clear Sunscreen Spray UVA/UVB Broad Spectrum SPF 50+,Sun Comfort Lotion UVA/UVB Broad Spectrum SPF 30,Sun Comfort Lotion UVA/UVB Broad Spectrum SPF 50+,Sunscreen Lip Balm Broad Spectrum SPF 45 w/ Aloe Vera and Vitamin E,TERRACOTTA SUNLESS - HEAVENLY BRONZING MIST - GRADUAL MADE-TO-MEASURE TAN,Tanning Dry Oil Clear Spray Sunscreen SPF 6,Tanning Lotion Sunscreen SPF 4,Tanning Oil Spray SPF 15,Tanning Spray Oil Sunscreen Spray SPF 8,Treatment,ULTIMATE PREP PRIMER,Ultra Sport Sunscreen Lip Balm SPF 50,Urban Undo Cleanser,Yoga Kitten,repair turnover peel pad"11,Arsenic (inorganic arsenic compounds),,,"Sun-Related Products,Hair Care Products (non-coloring),Hair Care Products (non-coloring),Hair Care Products (non-coloring),Hair Care Products (non-coloring),Hair Care Products (non-coloring),Hair Care Products (non-coloring),Skin Care Products ,Skin Care Products ","Breathable Coverage Mineral Foundation SPF 30,Hydrate Shampoo,Intensity Conditioning Therapy,Interrupt Texturizing Clay,Moisturizing Conditioner,Moisturizing Shampoo,Post-Skin Resurfacing Balm Therapeutic Care"12,Arsenic (inorganic oxides),,,Sun-Related Products,Breathable Coverage Mineral Foundation SPF-3013,Aspirin,,,"Shaving Products,Shaving Products,Shaving Products,Skin Care Products ,Shaving Products,Shaving Products,Shaving Products,Shaving Products","Club Mend Bump Repair Gel,In-Grown Hair and Razor Bump Creme,No Bump,No Bump Body Scrub,Skin Tight,Skin Tight - Extra Strength,Tend Skin Liquid,Woody Bump Repair"14,Avobenzone,,,"Skin Care Products ,Sun-Related Products,Skin Care Products ,Skin Care Products ,Sun-Related Products,Sun-Related Products,Sun-Related Products,Sun-Related Products,Makeup Products (non-permanent),Sun-Related Products,Sun-Related Products,Sun-Related Products,Makeup Products (non-permanent)","Daily Anti-Aging Moisturizer Broad Spectrum SPF30,ESSENTIAL deep moisturizing and oxygenating cream SPF 20 normal to dry skin,EveryDay Nourishing Lotion SPF 50,Hydrating Lip Balm SPF 30 (Nude),Hydrating Lip Balm SPF 30 (Pink),Hydrating Lip Balm SPF 30 (Red),Hydrating Lip Balm SPF 30 - TRIO SET,Quick Dry Body Spray Duo,Quick Dry Spray SPF40,SHAMELESS YOUTHFUL-LOOK 24H FOUNDATION"15,Benz[a]anthracene,,,"Makeup Products (non-permanent),Skin Care Products ",Anti-Aging Eye and Lip Perfection a Porter16,Benzene,,,"Hair Care Products (non-coloring),Hair Care Products (non-coloring),Hair Care Products (non-coloring),Hair Care Products (non-coloring),Hair Care Products (non-coloring)","Curl Lock Conditioner,Hydrate Conditioner,Texture Cream,Texture Cream Casual Styler"17,Benzo[a]pyrene,,,"Makeup Products (non-permanent),Skin Care Products ",Anti-Aging Eye and Lip Perfection a Porter18,Benzophenone,,,"Hair Care Products (non-coloring),Nail Products,Skin Care Products ,Skin Care Products ,Skin Care Products ,Skin Care Products ,Skin Care Products ,Skin Care Products ,Skin Care Products ,Skin Care Products ,Skin Care Products ,Skin Care Products ,Skin Care Products ,Skin Care Products ,Skin Care Products ,Makeup Products (non-permanent),Skin Care Products ,Makeup Products (non-permanent),Makeup Products (non-permanent),Makeup Products (non-permanent),Makeup Products (non-permanent),Makeup Products (non-permanent),Makeup Products (non-permanent),Makeup Products (non-permanent),Makeup Products (non-permanent),Skin Care Products ,Skin Care Products ,Skin Care Products ,Skin Care Products ,Personal Care Products,Skin Care Products ,Fragrances,Fragrances,Fragrances,Fragrances,Fragrances,Fragrances,Nail Products,Bath Products,Bath Products,Hair Care Products (non-coloring),Skin Care Products ,Sun-Related Products,Skin Care Products ,Skin Care Products ,Skin Care Products ,Skin Care Products ,Skin Care Products ,Makeup Products (non-permanent),Makeup Products (non-permanent),Makeup Products (non-permanent),Makeup Products (non-permanent),Makeup Products (non-permanent),Makeup Products (non-permanent),Makeup Products (non-permanent),Makeup Products (non-permanent),Makeup Products (non-permanent),Makeup Products (non-permanent),Makeup Products (non-permanent),Makeup Products (non-permanent),Makeup Products (non-permanent),Makeup Products (non-permanent),Makeup Products (non-permanent),Makeup Products (non-permanent),Makeup Products (non-permanent),Makeup Products (non-permanent),Makeup Products (non-permanent),Makeup Products (non-permanent),Makeup Products (non-permanent),Makeup Products (non-permanent),Makeup Products (non-permanent),Makeup Products (non-permanent),Makeup Products (non-permanent),Makeup Products (non-permanent),Makeup Products (non-permanent),Makeup Products (non-permanent),Skin Care Products ,Skin Care Products ,Skin Care Products ,Skin Care Products ,Skin Care Products ,Skin Care Products ,Skin Care Products ,Skin Care Products ,Skin Care Products ,Skin Care Products ,Makeup Products (non-permanent),Makeup Products (non-permanent),Makeup Products (non-permanent),Makeup Products (non-permanent),Makeup Products (non-permanent),Skin Care Products ,Skin Care Products ,Sun-Related Products,Skin Care Products ,Skin Care Products ,Skin Care Products ,Skin Care Products ,Skin Care Products ,Skin Care Products ,Skin Care Products ,Skin Care Products ,Skin Care Products ,Skin Care Products ,Skin Care Products ,Skin Care Products ,Skin Care Products ,Makeup Products (non-permanent),Makeup Products (non-permanent),Makeup Products (non-permanent),Makeup Products (non-permanent),Skin Care Products ,Makeup Products (non-permanent),Makeup Products (non-permanent),Makeup Products (non-permanent),Makeup Products (non-permanent),Makeup Products (non-permanent),Makeup Products (non-permanent),Makeup Products (non-permanent),Makeup Products (non-permanent),Makeup Products (non-permanent),Makeup Products (non-permanent),Makeup Products (non-permanent),Makeup Products (non-permanent),Makeup Products (non-permanent),Makeup Products (non-permanent),Makeup Products (non-permanent),Makeup Products (non-permanent),Makeup Products (non-permanent),Makeup Products (non-permanent),Fragrances,Hair Care Products (non-coloring),Skin Care Products ,Skin Care Products ,Bath Products,Nail Products,Hair Care Products (non-coloring),Nail Products,Makeup Products (non-permanent),Makeup Products (non-permanent),Makeup Products (non-permanent),Makeup Products (non-permanent),Skin Care Products ,Nail Products,Nail Products,Nail Products,Nail Products,Nail Products,Nail Products,Nail Products,Nail Products,Nail Products,Nail Products,Nail Products,Nail Products,Nail Products,Nail Products,Nail Products,Nail Products,Nail Products,Nail Products,Nail Products,Nail Products,Nail Products,Nail Products,Nail Products,Hair Care Products (non-coloring),Hair Care Products (non-coloring),Hair Care Products (non-coloring),Nail Products,Skin Care Products ,Bath Products,Hair Care Products (non-coloring),Makeup Products (non-permanent),Sun-Related Products,Makeup Products (non-permanent),Sun-Related Products,Makeup Products (non-permanent),Sun-Related Products,Makeup Products (non-permanent),Sun-Related Products,Makeup Products (non-permanent),Sun-Related Products,Makeup Products (non-permanent),Sun-Related Products,Makeup Products (non-permanent),Sun-Related Products,Makeup Products (non-permanent),Sun-Related Products,Makeup Products (non-permanent),Sun-Related Products,Makeup Products (non-permanent),Sun-Related Products,Makeup Products (non-permanent),Sun-Related Products,Makeup Products (non-permanent),Sun-Related Products,Makeup Products (non-permanent),Sun-Related Products,Makeup Products (non-permanent),Sun-Related Products,Makeup Products (non-permanent),Sun-Related Products,Makeup Products (non-permanent),Sun-Related Products,Makeup Products (non-permanent),Sun-Related Products,Makeup Products (non-permanent),Sun-Related Products,Makeup Products (non-permanent),Sun-Related Products,Skin Care Products ,Skin Care Products ,Skin Care Products ,Skin Care Products ,Skin Care Products ,Skin Care Products ,Skin Care Products ,Skin Care Products ,Skin Care Products ,Skin Care Products ,Skin Care Products ,Nail Products,Personal Care Products,Skin Care Products ,Skin Care Products ,Skin Care Products ,Skin Care Products ,Skin Care Products ,Skin Care Products ,Skin Care Products ","2 in 1 Shampoo,Acrylic Liquid,Age Management Balancer,Anti-Aging Complex,Anti-Aging Day Cream Sunscreen Broad Spectrum SPF 30,Anti-Aging Emulsion Sunscreen Broad Spectrum SPF 30,Anti-Aging Eye Cream SPF 15,Anti-Aging Eye and Lip Contour Cream,Anti-Aging Eye and Lip Perfection a Porter,Anti-Aging Hydratint Sunscreen SPF 20,Anti-Aging Longevity Serum,Anti-Aging Neck Cream,Antiperspirant Invisible Solid Powder,Artistry 8 Essentials Hydrating Lotion SPF 15,BOTTEGA VENETA L'ABSOLU EAU DE PARFUM NATURAL SPRAY,BOTTEGA VENETA PARCO PALLADIANO  XI CASTAGNO EAU DE PARFUM NATURAL SPRAY,BOTTEGA VENETA PARCO PALLADIANO  XII QUERCIA EAU DE PARFUM NATURAL SPRAY,BOTTEGA VENETA PARCO PALLADIANO  XIII QUADRIFOGLIO  EAU DE PARFUM NATURAL SPRAY,BOTTEGA VENETA PARCO PALLADIANO III,BOTTEGA VENETA PARCO PALLADIANO XVI PEONIA EAU DE PARFUM NATURAL SPRAY,Barielle Nail Shade,Beauty Bar Pink,Boosta Volumizing Spray,Cellular Anti-Wrinkle Firming Serum,Cellular Anti-Wrinkle Sun Cream SPF 30,Cellular Eye Contour Cream,Cellular Eye Makeup Remover,Cellular Hand Cream,Cellular Hydralift Firming Mask,Cellular Hydrating Serum,Cellular Lip Color Effects,Cellular Lip Renewal Concentrate,Cellular Luxe Lip Color,Cellular Luxe Lip Enhancer,Cellular Mineral Body Exfoliator,Cellular Mineral Face Exfoliator,Cellular Night Repair Cream,Cellular Power Charge Night,Cellular Power Infusion,Cellular Radiance Concentrate Pure Gold,Cellular Radiance Cream,Cellular Radiance Cream Blush,Cellular Radiance Emulsion SPF 30,Cellular Radiance Eye Cream,Cellular Radiance Night Cream,Cellular Revitalizing Eye Gel,Cellular Serum Plantinum Rare,Cellular Softening and Balancing Lotion,Cellular Swiss Ice Crystal Cream,Cellular Swiss Ice Crystal Dry Oil,Cellular Swiss Ice Crystal Transforming Cream SPF 50,Cellular Time Release Moisturizer Intensive,Cellular Treatment Bronzing Powder,Cellular Treatment Foundation Powder Finish,Cellular Treatment Illuminating Face Powder,Cellular Treatment Loose Powder,Cellular Treatment Powder Blush,Eau de Parfum,Expanda Volume Root Energizer,Extrait of Skin Caviar Firming Complex,Foam Cleanser,Growth Activator,Hair Spray,Instant Nail Hardener,Light Fantastic Cellular Concealing Brightening Eye Treatment,Moisture Plus,Moisture Restore Intense Moisturizer,Nail Brightener,Nail Treatment,Natural Nail Camouflage,No Chip Speed Dry,PetLab ExtractosTM - Detangling Spray - COMFREY - 8 FL OZ (237 ml),PetLab ExtractosTM - Shampoo Long Hair - COMFREY - 1 GAL (3.79 L),PetLab ExtractosTM - Shampoo Long Hair - COMFREY - 10 FL OZ (296 ml),Protect Plus Color,Purifying Cream Cleanser,Session Max Heavy Hold Hairspray,Skin Caviar Concealer Foundation SPF 15,Skin Caviar Crystalline Concentre,Skin Caviar Liquid Lift,Skin Caviar Luxe Body Cream,Skin Caviar Luxe Cream,Skin Caviar Luxe Cream - Sheer,Skin Caviar Luxe Eye Lift Cream,Skin Caviar Luxe Sleep Mask,Skin Caviar Luxe Souffle Body Cream,Ultra Speed Dry Manicure / Top Coat,Wet Cleaning Towelettes,White Caviar Illuminating Eye Cream,White Caviar Illuminating Eye Serum,White Caviar Illuminating Hand Cream,White Caviar Illuminating Moisturizing Cream,White Caviar Illuminating Serum,White Caviar Spot Treatment"19,Benzophenone-2,,,"Hair Care Products (non-coloring),Fragrances,Fragrances","Elixir Collection Scalp Therapy Elixir,Sultan de Muscat eau de parfum,Sultan de Muscat eau de parfum for men"